{
  "artifacts": [],
  "created_at": "2026-08-16T16:00:00Z",
  "finding_counts": {
    "critical": 0,
    "high": 0,
    "info": 0,
    "low": 0,
    "medium": 0
  },
  "package_identities": [
    "python:packrehearsal@1.1.0"
  ],
  "receipt_id": "59d1e220edef80e03954825366f888fa5aad3b5e21ca54d3316722f33fb4a8e8",
  "report_scan_id": "8b76a21618f03d09916b2cda8ccf06a12f81566a8de53ed4d5871233275a6edd",
  "report_sha256": "63f3a09581311b37f1e12c6d8ec22d97a045da583c4a8ced4d04d082144f9f0e",
  "schema_version": "1",
  "tool": "packrehearsal",
  "tool_version": "1.1.0"
}
